<?xml version="1.0" encoding="UTF-8"?>
<eshu xmlns="http://www.example.org/EshuConfig" xmlns:xsi="http://www.w3.org/2001/XMLSchema-instance" xsi:schemaLocation="http://www.example.org/EshuConfig EshuConfig.xsd ">
  <style>
    <editorStyle width="1000" height="700" borderWidth="1" 
          borderColor="#000" background="#FFFFFF"  
          gridVisible="false" gridColorLine="#c0c0c0"/>
    
    <toolbarStyle width="500" height="300" borderWidth="1"
       				borderColor="black" background="WhiteSmoke"
       				position="vertical"  />
      
    <vertice width="70" height="40" background="white"
        		backgroundSelected="blue" borderWidth="1" borderColor="red"/> 
      
    <textBox font="Georgia" color="Green" colorSelected="Black" align="left"
        		spacing="3px" backgroundSelected="Blue"/>
    <validation_syntaxe>false</validation_syntaxe> 
    
  </style>
  
   <diagram name="EER" pathFile="./EERConfig.xml">
    <nodeTypes>
    
      <nodeConfig>
        <type>Attribute</type>
        <iconTollbarSVGPath>./image/eer/atributo.svg</iconTollbarSVGPath>
        <imgSVGPath>./image/eer/atributo.svg</imgSVGPath>
         <label defaultValue="Attribute" firstLetterCase="lowercase" letterCase="lowercase" position="center" disabled="false" alignment="center" >
         <underlined controler="none" value="0"/>
        </label>
        <variant>Attribute</variant>
        <isConfigurable>true</isConfigurable>
        <includeElement>false</includeElement>
         <infoUrlNode>
         	<url>http://www.dcc.fc.up.pt/~fds/aulas/BD/1516/Slides/parteII.pdf</url>
         	<url>https://www.google.pt</url>
         </infoUrlNode>
         <anchors> 
             <anchor  position="north"/>
             <anchor  position="south"/> 
             <anchor  position="east"/>
             <anchor  position="west"/> 
         </anchors>
        <propertiesNode> 
          <property name="type" type="String" typeShow="input" disabled="true" impExp="true" view="true"  />
	      <property name="id" type="Number" typeShow="input" disabled="true" impExp="true" view="true" /> 
          <property name="x" type="Number" typeShow="input" disabled="false" impExp="true" view="true" /> 
	      <property name="y" type="Number" typeShow="input" disabled="false" impExp="true" view="true" />
	      <property name="width" type="Number" typeShow="input" disabled="false" impExp="true" view="true" /> 
	      <property name="height" type="Number" typeShow="input" disabled="false" impExp="true" view="true" /> 
	      <property name="label" type="String" typeShow="input" disabled="false" impExp="true" view="true"/> 
        </propertiesNode>
        <featuresNode>
        </featuresNode>
        <connects>
          <connect max="unbounded" min="0" to="Entity" with="Line"/> 
          <connect max="unbounded" min="0" to="EntityWeak" with="Line"/>
	 	  <connect max="unbounded" min="0" to="Attribute" with="Line"/> 
          <connect max="unbounded" min="0" to="AttributeDerived" with="Line"/>
          <connect max="unbounded" min="0" to="AttributeMultivalue" with="Line"/>
          <connect max="unbounded" min="0" to="AttributeKey" with="Line"/>
          <connect max="unbounded" min="0" to="AttributeKeyWeak" with="Line"/>
          <connect max="unbounded" min="0" to="Relationship" with="Line"/>
          <connect max="unbounded" min="0" to="WeakRelationship" with="Line"/>
        </connects> 
        <degreeIn>unbounded</degreeIn>
        <degreeOut>unbounded</degreeOut>
        <nodeStyle autoresize="true"/>
      </nodeConfig>
      
     <nodeConfig>
        <type>AttributeDerived</type>
        <iconTollbarSVGPath>./image/eer/atributo_derivado_icon.svg</iconTollbarSVGPath>
        <imgSVGPath>./image/eer/atributo_derivado.svg</imgSVGPath>
         <label defaultValue="Attribute" firstLetterCase="lowercase" letterCase="lowercase" position="center" disabled="false" alignment="center">
         <underlined controler="none" value="0"/>
        </label>
        <variant>Attribute</variant>
        <isConfigurable>true</isConfigurable>
        <includeElement>false</includeElement>
         <infoUrlNode>
         	<url>http://www.dcc.fc.up.pt/~fds/aulas/BD/1516/Slides/parteII.pdf</url>
         	<url>https://www.google.pt</url>
         </infoUrlNode>
         <anchors> 
             <anchor  position="north"/>
             <anchor  position="south"/> 
             <anchor  position="east"/>
             <anchor  position="west"/> 
         </anchors>
        <propertiesNode> 
          <property name="type" type="String" typeShow="input" disabled="true" impExp="true" view="true"  />
	      <property name="id" type="Number" typeShow="input" disabled="true" impExp="true" view="true" /> 
          <property name="x" type="Number" typeShow="input" disabled="false" impExp="true" view="true" /> 
	      <property name="y" type="Number" typeShow="input" disabled="false" impExp="true" view="true" />
	      <property name="width" type="Number" typeShow="input" disabled="false" impExp="true" view="true" /> 
	      <property name="height" type="Number" typeShow="input" disabled="false" impExp="true" view="true" /> 
	      <property name="label" type="String" typeShow="input" disabled="false" impExp="true" view="true"/> 
        </propertiesNode>
        <featuresNode>
        </featuresNode>
        <connects>
          <connect max="1" min="0" to="Attribute" with="Line"/> 
          <connect max="1" min="0" to="Entity" with="Line"/> 
          <connect max="1" min="0" to="EntityWeak" with="Line"/> 
          <connect max="1" min="0" to="Relationship" with="Line"/>
          <connect max="1" min="0" to="WeakRelationship" with="Line"/>
          
        </connects>
        <degreeIn>1</degreeIn>
        <degreeOut>1</degreeOut>
        <nodeStyle autoresize="true"/>
      </nodeConfig>
     
      <nodeConfig>
       
        <type>AttributeMultivalue</type>
        <iconTollbarSVGPath>./image/eer/atributo_multivalor_icon.svg</iconTollbarSVGPath>
        <imgSVGPath>./image/eer/atributo_multivalor.svg</imgSVGPath>
         <label defaultValue="Attribute" firstLetterCase="lowercase" letterCase="lowercase" position="center" disabled="false" alignment="center">
         <underlined controler="none" value="0"/>
        </label>
        <variant>Attribute</variant>
        <isConfigurable>true</isConfigurable>
        <includeElement>false</includeElement>
         <infoUrlNode>
         	<url>http://www.dcc.fc.up.pt/~fds/aulas/BD/1516/Slides/parteII.pdf</url>
         	<url>https://www.google.pt</url>
         </infoUrlNode>
         <anchors> 
             <anchor  position="north"/>
             <anchor  position="south"/> 
             <anchor  position="east"/>
             <anchor  position="west"/> 
         </anchors>
        <propertiesNode> 
          <property name="type" type="String" typeShow="input" disabled="true" impExp="true" view="true"  />
	      <property name="id" type="Number" typeShow="input" disabled="true" impExp="true" view="true" /> 
          <property name="x" type="Number" typeShow="input" disabled="false" impExp="true" view="true" /> 
	      <property name="y" type="Number" typeShow="input" disabled="false" impExp="true" view="true" />
	      <property name="width" type="Number" typeShow="input" disabled="false" impExp="true" view="true" /> 
	      <property name="height" type="Number" typeShow="input" disabled="false" impExp="true" view="true" /> 
	      <property name="label" type="String" typeShow="input" disabled="false" impExp="true" view="true"/> 
        </propertiesNode>
        <featuresNode>
        </featuresNode>
        <connects>
          <connect max="1" min="0" to="Attribute" with="Line"/>   
          <connect max="1" min="0" to="Entity" with="Line"/> 
          <connect max="1" min="0" to="EntityWeak" with="Line"/> 
          <connect max="1" min="0" to="Relationship" with="Line"/>
          <connect max="1" min="0" to="WeakRelationship" with="Line"/>
        </connects>
        
        <degreeIn>1</degreeIn>
        <degreeOut>1</degreeOut>
        <nodeStyle autoresize="true"/>
        
      </nodeConfig> 
      
      
      <nodeConfig>
       <type>AttributeKey</type>
        <iconTollbarSVGPath>./image/eer/atributoChave.svg</iconTollbarSVGPath>
        <imgSVGPath>./image/eer/atributo.svg</imgSVGPath>
         <label defaultValue="Attribute" firstLetterCase="lowercase" letterCase="lowercase" position="center" disabled="false" alignment="center" >
         <underlined controler="none" value="1"/>
        </label>
        <variant>Attribute</variant>
        <isConfigurable>true</isConfigurable>
        <includeElement>false</includeElement>
         <infoUrlNode>
         	<url>http://www.dcc.fc.up.pt/~fds/aulas/BD/1516/Slides/parteII.pdf</url>
         	<url>https://www.google.pt</url>
         </infoUrlNode>
         <anchors> 
             <anchor  position="north"/>
             <anchor  position="south"/> 
             <anchor  position="east"/>
             <anchor  position="west"/> 
         </anchors>
        <propertiesNode> 
          <property name="type" type="String" typeShow="input" disabled="true" impExp="true" view="true"  />
	      <property name="id" type="Number" typeShow="input" disabled="true" impExp="true" view="true" /> 
          <property name="x" type="Number" typeShow="input" disabled="false" impExp="true" view="true" /> 
	      <property name="y" type="Number" typeShow="input" disabled="false" impExp="true" view="true" />
	      <property name="width" type="Number" typeShow="input" disabled="false" impExp="true" view="true" /> 
	      <property name="height" type="Number" typeShow="input" disabled="false" impExp="true" view="true" /> 
	      <property name="label" type="String" typeShow="input" disabled="false" impExp="true" view="true"/> 
        </propertiesNode>
        <featuresNode>
        </featuresNode>
        <connects>